id;title;content;image;create_time
1;white SMTP;Checking Account global Steel;Borders Springs connecting;2019-11-06T20:26:48
2;connecting Planner Refined;engage Granite Grocery;bluetooth payment digital;2019-11-06T06:09:28
3;Checking Account;seamless New York mesh;Unbranded array;2019-11-06T14:41:41
4;Spurs Regional;Home Loan Account;CFP Franc back-end Via;2019-11-06T07:37:24
5;compress Practical Steel Chips;Berkshire concept;Illinois robust;2019-11-06T14:56:21
6;Creek;Shirt Metal;Mouse Rupiah;2019-11-06T17:57:13
7;RSS Buckinghamshire Officer;teal Licensed Wooden Pants;e-business;2019-11-07T03:04:12
8;Brazil;Island cyan;Granite open architecture;2019-11-06T20:06:55
9;Licensed;Credit Card Account Sleek;Sausages streamline Home;2019-11-06T06:59:39
10;Handmade Savings Account Manager;cultivate Bedfordshire;navigate Kiribati;2019-11-06T10:32:28
